author,datePublished,summary,title"David Milliken,Elizabeth Piper","May 1, 2019 /  5:15 PM / in a month","LONDON (Reuters) - British Prime Minister Theresa May fired her defense minister on Wednesday over a leak of discussions in the National Security Council about Chinese telecoms company Huawei, the latest of her allies to be ousted from government. ",UK's May fires defense secretary over Huawei leak
"Sayanti Chakraborty,Stephen Nellis","May 1, 2019 /  8:20 PM / a month ago","(Reuters) - Qualcomm Inc shares fell about 3.5% on Wednesday as investors got their first look at the bottom line impact of a patent fight settlement with Apple Inc, including a multibillion dollar one-time payment and more modest future patent fees. ",Qualcomm hangs on to most Apple gains after earnings report
David Shepardson,"May 2, 2019 /  4:46 PM / a month ago",WASHINGTON (Reuters) - Alphabet Inc’s Google unit told a U.S. House panel it spends hundreds of millions of dollars annually on content review and said it manually reviewed more than 1 million suspected “terrorist videos” on YouTube in the first three months of 2019. ,Google spends hundreds of millions of dollars on content review: letter
,"May 2, 2019 /  8:19 AM / a month ago","LONDON (Reuters) - A British government minister will be called to parliament on Thursday to answer a question on the findings of an inquiry into the disclosure of confidential information relating to Chinese telecoms company Huawei, the opposition Labour Party said. ",Government to answer urgent question on Huawei leak: Labour Party
Jack Stubbs,"May 2, 2019 /  11:01 AM / a month ago","LONDON (Reuters) - Up to 50,000 companies running SAP software are at greater risk of being hacked after security researchers found new ways to exploit vulnerabilities of systems that haven’t been properly protected and published the tools to do so online. ","50,000 companies exposed to hacks of 'business critical' SAP systems: researchers"
,"May 2, 2019 /  7:22 PM / a month ago","(Reuters) - Verizon Communications Inc is seeking a buyer for its blogging website Tumblr, the Wall Street Journal reported on Thursday, citing people familiar with the matter. ",Verizon looking to sell Tumblr: WSJ
"Jan Lopatka,Michael Kahn","May 2, 2019 /  4:45 PM / in a month","PRAGUE (Reuters) - Global cooperation is key to ensuring the security of 5G networks, cyber security officials said on Thursday at a meeting in Prague aimed at hammering out how to combat threats as nations begin rolling out next-generation telecoms equipment. ",Global security officials to hammer out united 5G security approach
,"May 2, 2019 /  11:06 AM / a month ago","LONDON (Reuters) - The British government needed to investigate the disclosure of secret information relating to Chinese telecoms company Huawei because it came from a classified intelligence briefing, the prime minister’s spokesman said on Thursday. ",UK investigated Huawei leak because it came from top intel briefing: UK PM spokesman
,"May 2, 2019 /  5:05 PM / a month ago",DUBLIN (Reuters) - U.S. digital advertising company Quantcast has became the latest technology firm to be investigated by Ireland’s Data Protection Commissioner. ,Quantcast latest tech company to face Irish privacy probe
Ernest Scheyder,"May 2, 2019 /  5:10 PM / a month ago","WASHINGTON (Reuters) - Tesla Inc expects global shortages of nickel, copper and other electric-vehicle battery minerals down the road due to underinvestment in the mining sector, the company’s global supply manager for battery metals told an industry conference on Thursday, according to two sources. ",Exclusive: Tesla expects global shortage of electric vehicle battery minerals - sources
Shariq Khan,"May 2, 2019 /  8:18 PM / a month ago","(Reuters) - Web hosting company GoDaddy Inc reported first-quarter profit below Wall Street expectations on Thursday, weighed down by persistent rising costs and slower customer growth, sending its shares 6 percent lower in after-hours trading. ",GoDaddy quarterly profit falls short of estimates as costs still weigh
Arjun Panchadar,"May 2, 2019 /  8:20 PM / a month ago","(Reuters) - Activision Blizzard Inc forecast second-quarter adjusted profit below estimates on Thursday, as the videogame maker puts more money into its franchises to battle competition from blockbuster games “Fortnite” and “Apex Legends”. ","Activision forecast miss clouds esports push, shares drop"
,"April 29, 2019 /  9:11 PM / a month ago","WASHINGTON (Reuters) - The Trump administration is ready to provide more federal aid to farmers if required, a White House adviser said on Monday, after rolling out up to $12 billion since last year to offset agricultural losses from the trade dispute with China. ",Trump administration eyes more aid to farmers if necessary: White House aide
"David Shepardson,Jeff Mason","April 29, 2019 /  4:11 PM / a month ago","WASHINGTON (Reuters) - A day before heading to the White House to meet with President Donald Trump, top Democrats in Congress on Monday said a bill to boost U.S. infrastructure must be funded with “substantial, new and real revenue” to meet massive needs across the country. ",Democrats insist on 'substantial' new revenue for U.S. infrastructure
Valerie  Volcovici,"April 29, 2019 /  3:57 PM / a month ago","(Reuters) - U.S. presidential candidate Beto O’Rourke on Monday laid out one of the most detailed climate policies so far in the crowded Democratic field, calling for a $5 trillion investment in clean energy technology and infrastructure over 10 years with a goal of reaching net-zero emissions by 2050. ",Democratic presidential candidate O'Rourke lays out $5 trillion climate plan
Stephen Nellis,"May 2, 2019 /  10:55 PM / a month ago",(Reuters) - Microsoft Corp on Thursday announced new tools for software makers aimed at making technologies such as artificial intelligence and blockchain easier for businesses to use.   ,Microsoft rolls out new cloud services for AI and blockchain
,"May 2, 2019 /  8:25 PM / in a month","(Reuters) - Cognizant Technology Solutions Corp on Thursday nearly halved its 2019 revenue expectations after missing first-quarter results, as the IT services and outsourcing company faces sluggish demand in its financial and healthcare businesses. ","Cognizant cuts 2019 forecasts on lower financial, healthcare demand"
Kate Duguid,"May 2, 2019 /  11:54 PM / in a month","NEW YORK (Reuters) - Tesla Inc should find no shortage of demand for the $1.35 billion convertible bond the electric carmaker is selling even though the terms it is offering look inferior on paper to a similar deal two years ago, bond investors said Thursday. ",Tesla seen finding ample appetite for its newest convertible bond
Stephen Nellis,"May 2, 2019 /  11:59 PM / in a month",(Reuters) - The U.S. Department of Justice’s antitrust division asked a federal judge on Thursday to hold a hearing on any possible remedies to be imposed if mobile chip supplier Qualcomm Inc is found liable in an antitrust lawsuit brought by the U.S. Federal Trade Commission. ,U.S. Justice Department asks for hearing in Qualcomm antitrust case
"Sheila  Dang,Paresh Dave","May 3, 2019 /  12:50 AM / a month ago",NEW YORK/SAN FRANCISCO (Reuters) - Alphabet Inc’s YouTube unveiled on Thursday nine new original programs that will be available for free this year as the streaming service shrinks an effort to attract subscribers with content exclusively behind a paywall.     The unveiling at a YouTube event for advertisers and media in New York offered the first glimpse at how the shift announced in November away from subscriber-only content will play out across the world.     ,YouTube touts first new original program under free strategy
,"May 2, 2019 /  9:28 PM / a month ago","(Reuters) - Facebook Inc’s potential settlement with U.S. regulators over breaches of consumer data privacy is nearing completion, and the agreement will likely include its WhatsApp messaging service, the Wall Street Journal reported on Thursday, citing people familiar with the matter.  ",Facebook's settlement with U.S. regulators likely to include WhatsApp: WSJ
"Akanksha Rana,Alexandria Sage","May 2, 2019 /  11:18 AM / a month ago","(Reuters) - Tesla Inc will raise up to $2.3 billion in new capital, renouncing what Elon Musk called a “Spartan diet” and easing Wall Street concerns about the money-losing company’s ability to overcome a drop in sales and build new product lines. ",Tesla ends 'Spartan diet' and seeks $2.3 billion to fund expansion
,"May 2, 2019 /  11:14 PM / a month ago","SYDNEY (Reuters) - A law firm filed a class action against Uber Technologies Inc on behalf of thousands of taxi and chartered drivers in Australia, accusing the world’s largest ride-hailing company of operating illegally and harming them financially. ",Uber faces lawsuit by Australian taxi drivers for 'illegal operations'
Karen Freifeld,"May 2, 2019 /  8:00 PM / a month ago",(Reuters) - Huawei Technologies said it will “vigorously oppose” a motion filed by U.S. prosecutors on Thursday to disqualify its lead defense lawyer from a case accusing the Chinese company of bank fraud and sanctions violations. ,Huawei says will fight U.S. prosecutors' motion to disqualify its lawyer
,"April 30, 2019 /  5:56 PM / a month ago","WASHINGTON (Reuters) - U.S. President Donald Trump will meet with congressional Democratic leaders soon to discuss drug prices, the White House said on Tuesday following infrastructure talks with House Speaker Nancy Pelosi and Senate Democratic leader Chuck Schumer. ","Trump, Democratic leaders to meet on drug prices soon: White House"
Hyunjoo Jin,"May 3, 2019 /  7:31 AM / a month ago","SEOUL (Reuters) - A South Korean automakers’ group called on Friday for an end to generous state subsidies for sales of Chinese electric vehicles (EVs), citing a potential threat to local automakers and Beijing’s “discrimination” against EVs equipped with Korean batteries.  ",South Korea automakers' group urges end to subsidies for Chinese EVs
Margaryta Chornokondratenko,"April 26, 2019 /  3:34 PM / a month ago","KIEV (Reuters) - A Ukrainian computer game that brings to life a town abandoned after the Chernobyl nuclear disaster may not sound like everyone’s idea of fun but has attracted 60,000 people globally since its launch in October. ",Chernobyl comes back to life in Ukrainian computer game
,"May 4, 2019 /  12:48 PM / in a month","LONDON (Reuters) - British police will not investigate the sacked defense minister, Gavin Williamson, after a senior officer said the information that was leaked about Chinese telecoms company Huawei was too minor to count as a criminal offence. ",UK police will not probe sacked defense minister over Huawei leak
,"May 4, 2019 /  10:10 PM / a month ago","BERLIN (Reuters) - Vodafone wants the German government to facilitate the rollout of ultrafast fiber broadband connections to homes and businesses by investing in the “last mile” of networks, the company’s Germany chief was quoted saying. ",Vodafone presses Germany for more help in broadband rollout: Welt am Sonntag
Paul Carrel,"April 25, 2019 /  12:55 PM / a month ago","JENA, Germany (Reuters) - From the 12th floor of Jenoptik’s headquarters, chief executive  Stefan Traeger points to his laser factory and the university that provides it with talent. Welcome to “Optics Valley” - a role model for Germany’s East in a big year for the region. ",Less to lose: Germany's poorer East embraces tech revolution
Joshua Franklin,"May 3, 2019 /  9:02 PM / a month ago","NEW YORK (Reuters) - Uber Technologies Inc’s drivers in New York will go on strike next week shortly before the ride-hailing company goes public to protest what they view as unfair employment conditions, a taxi union said on Friday. ",Ride-hailing drivers in New York to strike ahead of Uber IPO
Mark Hosenball,"May 1, 2019 /  6:53 PM / a month ago","WASHINGTON (Reuters) - The former head of White House security clearances told congressional investigators on Wednesday he was never instructed to change a security clearance determination by anyone at the White House, a source familiar with his closed-door interview said. ",Official says White House never told him to change a security clearance decision -source
"Munsif Vengattil,Paresh Dave","May 6, 2019 /  1:40 AM / a month ago","HYDERABAD, India/SAN FRANCISCO (Reuters) - Facebook Inc has thousands of content labelers around the world who categorize content with the aim of creating large datasets that can be more readily analyzed by humans and software. ",Factbox: The work at one Facebook 'labeling' project
,"May 2, 2019 /  1:27 AM / a month ago","(Reuters) - Facebook Inc and the Federal Trade Commission (FTC) are negotiating a possible settlement that would require the company to create an independent privacy oversight committee and take other steps to safeguard users, Politico reported on Wednesday, citing a source. ",Facebook settlement with U.S. may include privacy oversight: Politico
,"May 6, 2019 /  9:31 AM / a month ago","BERLIN (Reuters) - German carmaker Volkswagen will join forces with China’s NIU to produce battery-powered kick scooters, German newspaper Die Welt reported on Monday without giving sources. ",Volkswagen teams up with China's NIU to make e-scooters: Die Welt
"Munsif Vengattil,Paresh Dave","May 6, 2019 /  1:40 AM / in a month","HYDERABAD, India/SAN FRANCISCO (Reuters) - Over the past year, a team of as many as 260 contract workers in Hyderabad, India has ploughed through millions of Facebook Inc photos, status updates and other content posted since 2014. ","Facebook 'labels' posts by hand, posing privacy questions"
"Julie  Zhu,Kane Wu","May 6, 2019 /  7:15 AM / a month ago","HONG KONG (Reuters) - Sequoia Capital China, widely viewed as a bellwether for Chinese tech investment, is set to lay off as much as 20 percent of its investment staff as a slowdown in the country’s tech sector saps appetite for risk, said two people with knowledge of the matter. ",Exclusive: Sequoia China to cut up to 20 percent of investment staff as tech growth slows - sources
,"May 6, 2019 /  2:46 PM / a month ago","(Reuters) - Alphabet Inc’s Google is set to roll out a dashboard-like function in its Chrome browser to offer users more control in fending off tracking cookies, the Wall Street Journal reported on Monday, citing people familiar with the matter. ",Google set to launch privacy tools to limit online tracking: WSJ
"Angela Moon,Paresh Dave","May 7, 2019 /  6:34 PM / a month ago","NEW YORK/MOUNTAIN VIEW, California (Reuters) - Alphabet Inc’s Google launched more affordable versions of its Pixel smartphone on Tuesday at about half the price of its current models, and dropped an exclusive U.S. distribution deal with Verizon Communications Inc, signaling a major shift in the tech giant’s hardware strategy.  ","Google launches $399 Pixel phone, more U.S. carriers will sell it"
Jan  Wolfe,"May 2, 2019 /  10:02 AM / a month ago","(Reuters) - Like numerous U.S. presidents before him, Donald Trump could cite the legal doctrine of “executive privilege” to try to block congressional investigators from getting access to certain documents and witnesses they are seeking. ",Explainer: Can Trump use executive privilege to block congressional probes?
,"May 8, 2019 /  5:21 AM / a month ago","HONG KONG (Reuters) - Hackers stole bitcoin worth $41 million from Binance, one of the world’s largest cryptocurrency exchanges, the company said on Wednesday, the latest in a string of thefts from cryptocurrency exchanges around the world.  ",Hackers steal $41 million worth of bitcoin from Binance cryptocurrency exchange
Noel Randewich,"May 8, 2019 /  8:09 PM / a month ago","SAN FRANCISCO (Reuters) - Lyft Inc’s stock slumped nearly 11% on Wednesday to a record low after the ride-hailing company posted a deep quarterly loss, putting pressure on Uber Technologies Inc as it prepares to price its initial public offering.  ","Lyft shares hit record low, piling pressure on Uber ahead of IPO"
Paresh Dave,"May 7, 2019 /  5:46 PM / a month ago","MOUNTAIN VIEW, Calif. (Reuters) - Alphabet Inc’s Google business on Tuesday announced new privacy controls for its services, including “Incognito mode” for Google Maps, and published new privacy commitments for its hardware, showing how increased public scrutiny is forcing greater transparency in Silicon Valley. ","Google debuts privacy controls, principles at I/O event"
Stephen Nellis,"May 8, 2019 /  7:45 PM / a month ago","SAN FRANCISCO (Reuters) - Intel Corp shares declined 2.5 percent on Wednesday after executives forecast modest profit growth over the next three years, signaling it is likely to lag big rivals as the once-dominant chipmaker catches up in technology. ","Intel shares drop, three-year outlook seen lagging rivals"
,"May 8, 2019 /  6:50 PM / a month ago","WASHINGTON (Reuters) - Democratic and Republican lawmakers both stressed the need for bipartisan privacy legislation on Wednesday but seemed divided on how willing they were to strengthen the Federal Trade Commission, which is expected to be tasked with enforcing an eventual law. ",Privacy-minded U.S. lawmakers divided over giving more powers to FTC
Naomi Tajitsu,"May 8, 2019 /  11:40 PM / a month ago",TOKYO (Reuters) - Japan’s Toyota Motor Corp and Panasonic Corp said they plan to establish a joint company to develop “connected” services to be used in homes and urban development.  ,"Toyota, Panasonic to set up company for 'connected' homes"
Aradhana Aravindan,"May 9, 2019 /  4:03 AM / a month ago","SINGAPORE (Reuters) - Google said on Thursday an anti-fake news law passed by Singapore’s parliament could stunt innovation, a quality that  the city-state wants to nurture under plans to expand its tech industry. ",Google says Singapore's fake news law could  hamper innovation
David Morgan,"April 29, 2019 /  11:31 PM / a month ago","WASHINGTON (Reuters) - U.S. House Judiciary Committee Chairman Jerrold Nadler said on Monday that Attorney General William Barr must testify before his panel on Thursday, despite Barr’s reported objections to a more aggressive format for questions planned by Democrats. ",House panel chairman says Barr must testify Thursday
,"April 30, 2019 /  4:42 AM / a month ago",SAN JUAN (Reuters) - The White House said on Monday it will ask the U.S. Senate to confirm the current members of Puerto Rico’s federally created financial oversight board after creditors of the bankrupt island successfully challenged the appointments on constitutional grounds. ,White House says will reappoint Puerto Rico oversight board
"Julie  Zhu,Kane Wu","May 8, 2019 /  10:09 AM / a month ago","HONG KONG (Reuters) - Chinese artificial intelligence (AI) provider Megvii Technology Ltd, commonly known as Face++, said on Wednesday it raised $750 million in its latest funding round. ",Chinese AI start-up Megvii raises $750 million ahead of planned HK IPO
"Gaurav Dogra,Patturaja  Murugaboopathy","May 9, 2019 /  6:24 AM / a month ago","BENGALURU (Reuters) - Three of China’s biggest tech companies are expected to report that they ramped up or broadly maintained their pace of quarterly spending to develop new technology and push into relatively new markets, as current growth drivers stall. ",Chinese tech firms' search for growth seen boosting costs in March quarter
Letitia Stein,"April 30, 2019 /  11:40 AM / a month ago","(Reuters) - Georgia Democrat Stacey Abrams, a rising Democratic Party star who narrowly fell short of becoming the first female black U.S. governor, said on Tuesday she would not run for the U.S. Senate in 2020 because it was not “the best role” for her. ","Georgia Democrat Abrams rules out U.S. Senate run, says not 'best' role"
Tom Wilson,"May 3, 2019 /  9:38 AM / a month ago","LONDON (Reuters) - Bitcoin jumped to a new six-month high on Friday in a move that traders said was the result of technical forces, with no immediate news catalysts sending the cryptocurrency higher.  ",Bitcoin jumps as much as 6 percent to new six-month high
Ernest Scheyder,"May 2, 2019 /  2:27 PM / a month ago","WASHINGTON (Reuters) - A U.S. senator plans to introduce legislation on Thursday to streamline regulation and permitting requirements for the development of mines for lithium, graphite and other electric-vehicle supply chain minerals, part of a plan to offset China’s dominance in the space. ",Exclusive: U.S. seeks to challenge China's electric-vehicle supply chain dominance
Akanksha Rana,"May 3, 2019 /  11:27 AM / a month ago","(Reuters) - Tesla Inc on Friday was set to raise up to $2.7 billion in a record-setting capital raising for the electric carmaker, as investors scooped up a mix of new stock and convertible notes that will recharge the company’s cash-depleted balance sheet. ","Tesla boosts capital raise to $2.7 billion, Musk buys more stock"
,"May 3, 2019 /  10:13 AM / a month ago","(Reuters) - Dish Network Corp fell short of estimates for quarterly profit on Friday, as the U.S. satellite TV service provider lost more pay-TV subscribers than expected and posted anemic growth in its streaming service Sling TV. ","Dish bleeds more pay-TV subscribers, Sling TV disappoints"
Melanie Burton,"May 3, 2019 /  11:28 AM / a month ago","MELBOURNE (Reuters) - Wesfarmers Ltd’s bid for Australia’s Kidman Resources undervalues the lithium miner, analysts said on Friday, reflecting the financing difficulties the sector faces even as electric car makers warn of raw material shortages. ",Wesfarmers' soft bid for Kidman spotlights lithium's financing issues
"Michael Kahn,Jan Lopatka","May 3, 2019 /  2:38 PM / a month ago","PRAGUE (Reuters) - Global security officials agreed a set of proposals on Friday for future 5G networks, highlighting concerns about equipment supplied by vendors that might be subject to state influence. ","Western allies agree 5G security guidelines, warn of outside influence"
"Philip Blenkinsop,Tom Miles","May 3, 2019 /  3:07 PM / a month ago","BRUSSELS/GENEVA (Reuters) - The European Union began a push for improved protection for traders and consumers involved in online transactions, as it published proposals on Friday launching what are likely to be long and hard WTO negotiations on regulating e-commerce. ","EU fleshes out WTO e-commerce proposal, faces obstacles"
,"May 4, 2019 /  10:54 AM / in a month",(Reuters) - Dutch chip equipment maker ASML Holding NV said on Saturday a U.S. court had issued its final judgment in favor of ASML in an intellectual property theft case against U.S. software maker Xtal. ,U.S. court rules in favor of Dutch ASML in IP theft case against Xtal
,"May 3, 2019 /  1:57 PM / a month ago","WARSAW (Reuters) - The world needs to be wary of the rise of tech giants such as Google, Apple, Facebook and Amazon, comparing their powers to those of countries such as China, European Council President Donald Tusk said in Warsaw on Friday.  ",EU's Tusk warns of risks in rise of U.S. tech giants
"Aluisio Alves,Daina Beth Solomon","May 7, 2019 /  2:04 PM / a month ago","SAO PAULO/MEXICO CITY (Reuters) - Brazilian fintech firm Nubank will open an office in Mexico on Tuesday, an initial step in a potential expansion into other Latin American countries, a company executive said. ",Brazil fintech Nubank opens Mexico office as it seeks Latam expansion
"David Shepardson,David Lawder","May 3, 2019 /  8:19 PM / a month ago","WASHINGTON (Reuters) - U.S. trade officials rejected Tesla Inc’s bid for relief from President Donald Trump’s 25-percent tariffs on the Chinese-made Autopilot “brain” of its Model 3 and other electric vehicles, one of more than 1,000 product denials linked to China’s industrial development plans. ",U.S. rejects Tesla bid for tariff exemption for Autopilot 'brain'
"Akanksha Rana,Angela Moon","May 7, 2019 /  8:23 PM / a month ago","(Reuters) - Sprint Corp on Tuesday reported deeper losses than feared of monthly phone subscribers despite discount offerings, raising concerns that the wireless carrier may not be sustainable if its pending merger with T-Mobile is not approved. ",Sprint loses more phone subscribers than feared in fourth quarter
Paresh Dave,"May 7, 2019 /  11:19 PM / a month ago","MOUNTAIN VIEW, Calif. (Reuters) - Alphabet Inc unit Google in the coming months plans to introduce new internet browser tools to limit how users’ web activity is tracked by advertising companies and give them greater insight into why certain ads are shown to them, the company announced in blog posts on Tuesday. ","Google plans new browser tools on privacy, ad transparency"
,"May 8, 2019 /  11:22 AM / a month ago","(Reuters) - Tesla Inc said on Wednesday it closed its $2.7 billion offering of stock and convertible notes and that it was over-subscribed, giving the electric carmaker much needed cash as it ramps up production. ","Tesla closes $2.7 billion mixed offering of shares, debt"
"David Shepardson,Diane Bartz","May 7, 2019 /  7:04 PM / a month ago","WASHINGTON (Reuters) - With a multibillion-dollar settlement looming for Facebook over user privacy violations, Chief Operating Officer Sheryl Sandberg met with U.S. lawmakers on Capitol Hill on Tuesday to discuss legislation to protect users of the social network, officials said. ",Facebook executive meets with U.S. lawmakers to discuss privacy
,"May 8, 2019 /  3:20 PM / a month ago","LONDON (Reuters) - The roll-out of 5G networks in Britain could be delayed, Culture Secretary Jeremy Wright said, adding that he would not trade off the economic benefit of using cheap kit with security risk. ",UK says 5G roll out could be delayed by security concerns
