author,datePublished,summary,title
,"June 3, 2019 /  4:07 PM / Updated 3 hours ago",(Reuters) - Alphabet Inc’s shares fell as much as 7% on Monday following reports that the U.S. Justice Department may investigate Google for hampering competition. ,Alphabet shares slide 7% on possible DoJ antitrust probe
Jan  Wolfe,"June 2, 2019 /  2:37 PM / Updated 4 hours ago","(Reuters) - The U.S. Justice Department is preparing an investigation of Alphabet Inc’s Google to determine whether the technology company violated laws to ensure fair competition, two sources familiar with the matter said. ",Explainer: Why Google has a target on its back in Washington
,"June 3, 2019 /  4:04 PM / Updated 3 hours ago","(Reuters) - Quest Diagnostics Inc said on Monday it was notified by a billing collections vendor that an unauthorized user gained access to information on nearly 11.9 million patients, including credit card numbers and bank account information.      ",Quest Diagnostics says data breach could have hit 11.9 million patients
,"June 3, 2019 /  4:49 PM / in 2 hours","HELSINKI (Reuters) - Nokia has attracted increased interest in its next-generation telecoms equipment in recent weeks, helping it to move ahead of Chinese rival Huawei in total 5G orders, one of the Finnish company’s directors said. ",Nokia says it has moved ahead of Huawei in 5G orders
Stephen Nellis,"June 3, 2019 /  11:04 AM / Updated 7 minutes ago","(Reuters) - Apple Inc on Monday launched a “Sign In With Apple” function to rival Facebook and Google web login accounts, drawing a contrast with rivals by stressing protection of users’ private information. ","Apple introduces web login, stresses privacy in challenge to Google, Facebook"
Emma Thomasson,"June 3, 2019 /  5:09 PM / Updated 2 hours ago","BERLIN (Reuters) - French retailer Carrefour SA has seen sales boosted by the use of blockchain ledger technology to track meat, milk and fruit from farms to stores and will extend it to more products to increase shopper trust, an executive said on Monday. ",Carrefour says blockchain tracking boosting sales of some products
,"June 3, 2019 /  4:19 PM / Updated 3 hours ago","MOSCOW (Reuters) - Russia said on Monday it had added the popular dating app Tinder to a list of entities obliged to hand over user data and messages to law enforcement agencies on demand, including the main successor agency to the Soviet-era KGB.  ",Russia orders Tinder dating app to share user data on demand
,"June 3, 2019 /  5:44 PM / Updated 42 minutes ago","WASHINGTON (Reuters) - The U.S. Justice Department has jurisdiction for a potential probe of Apple Inc as part of a broader review of whether technology giants are using their size to act in an anti-competitive manner, two sources told Reuters. ",Exclusive: U.S. Justice Dept considering Apple probe - sources
,"June 3, 2019 /  6:24 PM / Updated 32 minutes ago","WASHINGTON (Reuters) - Donald Trump’s son-in-law and White House adviser Jared Kushner denied that he spoke with the president about his security clearance, according to an interview with the Axios news outlet that comes amid a congressional investigation of the issue.  ",Kushner denies discussing his security clearance with Trump
,"June 3, 2019 /  4:03 PM / Updated an hour ago","(Reuters) - The Federal Trade Commission (FTC) has secured the right to examine how Facebook Inc’s practices affect its digital competition, the Wall Street Journal reported on Monday. ",FTC wins right for competition probe at Facebook: WSJ
,"June 3, 2019 /  1:49 PM / Updated 5 hours ago",(Reuters) - Chipmaker Advanced Micro Devices shares rose 7 percent in early trading on Monday after the company announced a deal with Samsung Electronics Co Ltd that could allow it to better compete with Nvidia Corp. ,AMD shares rise on mobile graphics tie-up with Samsung
Frank Jack Daniel,"June 3, 2019 /  5:13 AM / Updated 31 minutes ago","MEXICO CITY (Reuters) - Fighting to stave off punitive tariffs announced by U.S. President Donald Trump, a senior Mexican delegation was set to begin high level talks on Monday in Washington, where it will be pushed to do more to hold back Central American migrants.  ","Reeling from tariff threat, Mexico begins immigration talks in Washington"
Idrees Ali,"June 2, 2019 /  10:15 AM / in a day","SEOUL (Reuters) - The Pentagon has told the White House that the U.S. military will not be politicized, a U.S. official said on Sunday, in response to a controversy after officials directed the United States Navy to keep the USS John S. McCain out of sight during a recent speech by President Donald Trump in Japan.  ","Amid USS McCain controversy, Pentagon says military will not be politicized"
,"May 27, 2019 /  10:41 PM / Updated 16 minutes ago","The NFL likely will investigate an altercation between Dallas Cowboys running back Ezekiel Elliott and a security officer to determine whether Elliott violated any terms of a previous suspension agreement, Yahoo Sports reported Monday. ",Report: NFL to review video of Cowboys' Elliott altercation
"Sharon Bernstein,Tim Reid","June 1, 2019 /  6:41 PM / a day ago","SAN FRANCISCO (Reuters) - (This June 1 story has been corrected to remove reference in paragraphs 12, 14-15 to a pamphlet purporting to be from the campaign of former Vice President Joe Biden, criticizing Bernie Sanders. It was not from Biden. Corrects spelling of Senator Booker’s name in fifth paragraph.) ","'Oh my God, is that Bernie Sanders?' Democrats swarm San Francisco"
"Sharon Bernstein,Tim Reid","June 2, 2019 /  7:26 PM / Updated a day ago","SAN FRANCISCO (Reuters) - U.S. Senator Bernie Sanders on Sunday called on California Democrats to unite against Donald Trump, kicking the 2020 presidential campaign into high gear with jabs against the Republican president and a veiled swipe at Democratic rival Joe Biden. ",Sanders kicks fight against Trump into high gear as Democrats swarm San Francisco
,"June 2, 2019 /  11:11 PM / Updated 8 hours ago",LONDON (Reuters) - Online retail giant Amazon said it would open pop-up shops in Britain to give more than 100 small online businesses an opportunity to sell on the high street for the first time. ,Amazon brings online sellers to UK high street in pop-up stores
,"June 3, 2019 /  5:41 AM / Updated 13 hours ago","SHANGHAI (Reuters) - China’s Ministry of Industry and Information Technology (MIIT)  will roll out commercial 5G licenses “in the near future”, Xinhua said.   ",China ministry will issue 5G licenses for commercial use in near future: Xinhua
,"June 3, 2019 /  7:09 AM / Updated 9 hours ago","FRANKFURT (Reuters) - Infineon Technologies expects to keep its investment grade credit rating after its 9 billion euro ($10 billion) agreed acquisition of U.S. Cypress Semiconductor, Chief Financial Officer Sven Schneider said on Monday.  ",Infineon expects to keep investment grade rating after Cypress deal
,"June 3, 2019 /  1:04 PM / Updated 6 hours ago",LONDON (Reuters) - U.S. President Donald Trump is visiting Britain this week on a state visit and is likely to urge the government to decide against allowing Chinese company Huawei to take part in its 5G telecoms infrastructure. ,Where do Britain's candidates for prime minister stand on Huawei?
,"June 3, 2019 /  6:59 AM / Updated 12 hours ago",(Reuters) - Food and biopharma product testing company Eurofins Scientific said on Monday that some of its IT systems were affected by a form of ransomware during the weekend.  ,Eurofins Scientific detects ransomware in some of its IT systems
Sam Nussey,"June 3, 2019 /  6:49 AM / Updated 10 hours ago","TOKYO (Reuters) - Japan’s SoftBank Corp said on Monday it will launch a service this year that would use satellite navigation data and the telco’s mobile base stations to help power self-driving buses, drones and farm machinery. ","SoftBank's service to help power self-driving buses, farm machinery"
"Arno Schuetze,Douglas Busvine","June 3, 2019 /  5:34 AM / Updated 5 hours ago","FRANKFURT (Reuters) - Germany’s Infineon has agreed to buy Silicon Valley-based Cypress Semiconductor for $10 billion, in an expensive move by Europe’s largest chip-maker to expand further in next-generation automobiles and Internet technologies. ",Infineon revs up auto business with $10 billion Cypress deal
,"June 3, 2019 /  7:34 AM / Updated 6 hours ago","LONDON (Reuters) - Britain takes careful notice of what the United States says on the risks of using Huawei in 5G networks and does not want to be overly dependent on a third country for certain technologies, Foreign Secretary Jeremy Hunt said on Monday. ","Britain listens to the United States on Huawei, foreign minister says"
Foo Yun Chee,"June 3, 2019 /  2:04 PM / Updated 5 hours ago","PARIS (Reuters) - EU regulators will decide what steps to take regarding Spotify’s complaint about Apple once they get a response from the iPhone maker, Europe’s antitrust chief said on Monday. ",EU wants to hear from Apple over Spotify complaint
Sarah N. Lynch,"May 30, 2019 /  9:35 PM / 3 days ago","WASHINGTON (Reuters) - U.S. Attorney General William Barr said Special Counsel Robert Mueller, who led a probe into Russian interference in the 2016 presidential election, could have reached a decision on whether President Donald Trump obstructed justice, but chose not to.  ",Attorney General Barr says Mueller 'could've reached a decision' on obstruction
,"May 31, 2019 /  5:12 PM / 3 days ago",WASHINGTON (Reuters) - The top Republican on the U.S. House committee that oversees trade said on Friday it was in the interest of both the United States and Mexico to reach an agreement on immigration before U.S. President Donald Trump hits Mexican products with tariffs. ,Influential U.S. Republican wants immigration deal to head off tariffs
Katie Paul,"June 1, 2019 /  5:08 AM / 3 days ago","SAN FRANCISCO (Reuters) - A U.S. judge on Friday denied Facebook Inc.’s request to dismiss a lawsuit by the Washington, D.C. attorney general over the social media giant’s improper sharing of 87 million users’ data with British political consulting firm Cambridge Analytica. ",U.S. judge waves through D.C. case against Facebook
,"June 2, 2019 /  4:39 AM / 2 days ago","(Reuters) - U.S. antitrust regulators have divided oversight of Amazon.com Inc and Alphabet Inc’s Google, putting Amazon under the watch of the Federal Trade Commission and Google under the Justice Department, the Washington Post said on Saturday. ",U.S. regulators divide scrutiny of Amazon and Google: Washington Post
"Steve Holland,Frank Jack Daniel","May 30, 2019 /  12:41 PM / 3 days ago","WASHINGTON/MEXICO CITY (Reuters) - U.S. President Donald Trump, responding to a surge of illegal immigrants across the southern border, vowed on Thursday to impose a tariff on all goods coming from Mexico, starting at 5% and ratcheting much higher until the flow of people ceases. ","Trump vows rapid, high tariffs on Mexico unless illegal immigration ends"
Diane Bartz,"June 1, 2019 /  12:44 AM / 2 days ago","(Reuters) - The U.S. Justice Department is preparing an investigation of Alphabet Inc’s Google to determine whether the tech giant broke antitrust law in operating its sprawling online businesses, two sources familiar with the matter said. ",U.S. Justice Department prepares Google antitrust probe: sources
Lisa Barrington,"June 2, 2019 /  6:13 PM / a day ago","DUBAI (Reuters) - Bahrain, a U.S. ally that hosts the Navy’s Fifth Fleet, has warned citizens and residents that following anti-government social media accounts could result in legal action, hardening a government campaign against critical online voices.  ",Bahrain says following opposition social media could result in legal action
,"June 2, 2019 /  8:46 PM / Updated 20 hours ago","(Reuters) - Facebook Inc is in talks with the U.S. derivatives regulator, the Commodity Futures Trading Commission (CFTC), over the social media company’s plans for a digital currency, the Financial Times reported on Sunday. ",Facebook in talks with U.S. derivatives regulator over digital currency plans: FT
,"June 3, 2019 /  1:42 AM / Updated 17 hours ago","SHANGHAI (Reuters) - The Institute of Electrical and Electronics Engineers (IEEE) said on Monday curbs on employees of Huawei Technologies and its subsidiaries have been lifted, and they would be allowed to participate in a peer review process for its research papers. ",U.S.-based engineers' body lifts curbs on Huawei employees
Uday Sampath Kumar,"June 2, 2019 /  10:19 PM / Updated 14 hours ago","(Reuters) - Alphabet Inc’s Google said on Sunday it had resolved the network congestion in the eastern United States that affected services in Google Cloud, G Suite and YouTube. ","Google says issues affecting YouTube, Gmail, Google Cloud in U.S. resolved"
,"June 3, 2019 /  2:54 AM / Updated 15 hours ago","(Reuters) - German chipmaker Infineon Technologies AG is nearing a deal to buy Cypress Semiconductor Corp, valuing the U.S. chipmaker at almost $10 billion, Bloomberg reported on Sunday. ",Germany's Infineon close to acquiring Cypress Semiconductor: Bloomberg
Sijia Jiang,"June 3, 2019 /  3:34 AM / Updated 13 hours ago","HONG KONG (Reuters) - Huawei Technologies Co Ltd plans to sell its undersea telecom cable business, showed a buyer’s filing on Monday, in its first major asset sale since the United States ratcheted up accusations of the Chinese firm being a vehicle for espionage. ","China's Huawei to sell undersea cable business, buyer's exchange filing shows"
Gary McWilliams,"June 3, 2019 /  4:34 AM / Updated 13 hours ago","(Reuters) - Huawei Technologies, the Chinese telecommunications equipment supplier fighting a U.S. sales ban, kicks off a trade secrets lawsuit in the United States on Monday against a former employee who has sought to turn the case into a referendum on Huawei’s corporate behavior. ",Huawei trade secrets lawsuit opens in Texas amid spying allegations
author,datePublished,summary,title
,"May 31, 2019 /  4:24 AM / 4 days ago","MEXICO CITY (Reuters) - Mexican central bank board member Jonathan Heath said on Twitter Thursday night “this is a game changer,” after U.S. President Donald Trump vowed to impose a tariff on all goods coming from Mexico if the flow of illegal immigrants across the southern border is not stopped. ",Mexico central bank board member says this is 'game changer' after U.S. tariff threat
,"May 31, 2019 /  3:00 AM / 4 days ago","MEXICO CITY (Reuters) - “America First is a fallacy,” Mexican President Andres Manuel Lopez Obrador told U.S. President Donald Trump in a letter on Thursday, responding to a White House announcement it was imposing a blanket 5% tariff on all goods from Mexico from June 10. ","'America First is a fallacy,' Mexico's president responds to Trump tariff"
Mica Rosenberg,"May 30, 2019 /  11:13 PM / 4 days ago",(Reuters) - A group of detained asylum seekers sued the U.S. government on Thursday claiming immigration officials in five southern states are systematically denying them parole.  ,More asylum seekers sue Trump administration over prolonged U.S. detention
"Katie Paul,Ross Kerber","May 30, 2019 /  11:08 AM / 4 days ago","MENLO PARK, Calif./BOSTON (Reuters) - Protesters carrying an inflatable angry emoji greeted Facebook Inc shareholders as they gathered for the company’s annual meeting on Thursday, the latest sign of its struggle to shake off privacy scandals and rein in fake news and hate speech. ",Inflatable angry emoji looms over Facebook annual meeting as users vent frustrations
"Yilei Sun,Brenda Goh","May 31, 2019 /  12:23 AM / 3 days ago","BEIJING/SHANGHAI (Reuters) - U.S. electric vehicle (EV) maker Tesla Inc said on Friday it would price its China-made Model 3 vehicles from 328,000 yuan ($47,529), 13% cheaper than those it currently imports as it pushes sales in the fast growing market.  ",Tesla promotes lower priced China-made Model 3 in sales push
,"May 31, 2019 /  10:24 AM / 3 days ago","BEIJING/SHANGHAI (Reuters) - Chinese electric vehicle (EV) maker Nio Inc is keen to build a production base in Beijing and will likely seek a manufacturing partner, Chief Executive Officer and founder William Li said this week. ","EV maker Nio plans Beijing plant, will likely seek a partner: CEO"
Jan  Wolfe,"May 31, 2019 /  11:04 AM / 3 days ago","(Reuters) - A rare public call by a U.S. Federal Trade Commission (FTC) official for one of the agency’s courtroom victories to be reversed, in a case of anticompetitive business practices by chipmaker Qualcomm Inc, charts a strong course for a judge’s ruling to be overturned on appeal, some legal experts said. ",Qualcomm has strong argument to win reversal of U.S. antitrust ruling: legal experts
"Alexandria Sage,Arjun Panchadar","May 30, 2019 /  8:09 PM / 3 days ago","SAN FRANCISCO/BENGALURU (Reuters) - Uber Technologies Inc reported a $1 billion loss on Thursday as the ride-hailing service spends heavily to build up its food delivery and freight businesses, sending revenues up 20% in its first quarterly report as a public company. ","Uber loses $1 billion in quarter as costs grow for drivers, food delivery"
Jonathan Stempel,"May 31, 2019 /  4:20 PM / 3 days ago","(Reuters) - A U.S. judge ordered Facebook Inc to give shareholders emails and other records concerning how the social media company handles data privacy, after data for 87 million users was accessed by the British political consulting firm Cambridge Analytica. ",Facebook ordered by U.S. judge to turn over data privacy records
David Brunnstrom,"May 31, 2019 /  5:34 AM / 3 days ago","BERLIN (Reuters) - The United States raised the pressure on Western allies in a war of attrition over next-generation networks on Friday, saying countries that allow China’s Huawei to build their telecoms infrastructure could be cut off from crucial intelligence data. ",Pompeo tells Germany: Use Huawei and lose access to our data
Tyler Choi,"May 31, 2019 /  11:15 AM / 3 days ago","TORONTO (Reuters) - Canada’s Digital Charter lacks sufficient legal enforcement power to effectively protect privacy and regulate use of personal data, according to critics worried that a smart city project in Toronto by Alphabet’s Sidewalk Labs unit could be misused for mass surveillance. ",Canada's Digital Charter does not comfort Alphabet's smart-city critics
Padraic Halpin,"May 31, 2019 /  9:35 AM / 3 days ago","DUBLIN (Reuters) - The European Court of Justice (ECJ) will hear a landmark privacy case regarding the transfer of EU citizens’ data to the United States in July, after Facebook’s bid to stop its referral was blocked by Ireland’s Supreme Court on Friday. ",Irish Supreme Court rejects Facebook bid to block ECJ data case
Sarah N. Lynch,"May 30, 2019 /  9:35 PM / 3 days ago","WASHINGTON (Reuters) - U.S. Attorney General William Barr said Special Counsel Robert Mueller, who led a probe into Russian interference in the 2016 presidential election, could have reached a decision on whether President Donald Trump obstructed justice, but chose not to.  ",Attorney General Barr says Mueller 'could've reached a decision' on obstruction
"Angela Moon,Sheila  Dang,Diane Bartz","May 30, 2019 /  10:50 PM / 3 days ago","(Reuters) - Amazon.com Inc is interested in buying prepaid cellphone wireless service Boost Mobile from U.S. carriers T-Mobile US Inc and Sprint Corp, two sources familiar with the matter said on Thursday. ","Exclusive: Amazon interested in buying Boost from T-Mobile, Sprint - sources"
"Steve Holland,Frank Jack Daniel","May 30, 2019 /  12:41 PM / 3 days ago","WASHINGTON/MEXICO CITY (Reuters) - U.S. President Donald Trump, responding to a surge of illegal immigrants across the southern border, vowed on Thursday to impose a tariff on all goods coming from Mexico, starting at 5% and ratcheting much higher until the flow of people ceases. ","Trump vows rapid, high tariffs on Mexico unless illegal immigration ends"
,"May 31, 2019 /  5:12 PM / 3 days ago",WASHINGTON (Reuters) - The top Republican on the U.S. House committee that oversees trade said on Friday it was in the interest of both the United States and Mexico to reach an agreement on immigration before U.S. President Donald Trump hits Mexican products with tariffs. ,Influential U.S. Republican wants immigration deal to head off tariffs
,"June 3, 2019 /  6:59 AM / Updated 12 hours ago",(Reuters) - Food and biopharma product testing company Eurofins Scientific said on Monday that some of its IT systems were affected by a form of ransomware during the weekend.  ,Eurofins Scientific detects ransomware in some of its IT systems
,"June 2, 2019 /  11:11 PM / Updated 8 hours ago",LONDON (Reuters) - Online retail giant Amazon said it would open pop-up shops in Britain to give more than 100 small online businesses an opportunity to sell on the high street for the first time. ,Amazon brings online sellers to UK high street in pop-up stores
,"June 3, 2019 /  7:09 AM / Updated 9 hours ago","FRANKFURT (Reuters) - Infineon Technologies expects to keep its investment grade credit rating after its 9 billion euro ($10 billion) agreed acquisition of U.S. Cypress Semiconductor, Chief Financial Officer Sven Schneider said on Monday.  ",Infineon expects to keep investment grade rating after Cypress deal
Idrees Ali,"June 2, 2019 /  10:15 AM / in a day","SEOUL (Reuters) - The Pentagon has told the White House that the U.S. military will not be politicized, a U.S. official said on Sunday, in response to a controversy after officials directed the United States Navy to keep the USS John S. McCain out of sight during a recent speech by President Donald Trump in Japan.  ","Amid USS McCain controversy, Pentagon says military will not be politicized"
"Arno Schuetze,Douglas Busvine","June 3, 2019 /  5:34 AM / Updated 5 hours ago","FRANKFURT (Reuters) - Germany’s Infineon has agreed to buy Silicon Valley-based Cypress Semiconductor for $10 billion, in an expensive move by Europe’s largest chip-maker to expand further in next-generation automobiles and Internet technologies. ",Infineon revs up auto business with $10 billion Cypress deal
"Sharon Bernstein,Tim Reid","June 1, 2019 /  6:41 PM / a day ago","SAN FRANCISCO (Reuters) - (This June 1 story has been corrected to remove reference in paragraphs 12, 14-15 to a pamphlet purporting to be from the campaign of former Vice President Joe Biden, criticizing Bernie Sanders. It was not from Biden. Corrects spelling of Senator Booker’s name in fifth paragraph.) ","'Oh my God, is that Bernie Sanders?' Democrats swarm San Francisco"
"Sharon Bernstein,Tim Reid","June 2, 2019 /  7:26 PM / Updated a day ago","SAN FRANCISCO (Reuters) - U.S. Senator Bernie Sanders on Sunday called on California Democrats to unite against Donald Trump, kicking the 2020 presidential campaign into high gear with jabs against the Republican president and a veiled swipe at Democratic rival Joe Biden. ",Sanders kicks fight against Trump into high gear as Democrats swarm San Francisco
Sam Nussey,"June 3, 2019 /  6:49 AM / Updated 10 hours ago","TOKYO (Reuters) - Japan’s SoftBank Corp said on Monday it will launch a service this year that would use satellite navigation data and the telco’s mobile base stations to help power self-driving buses, drones and farm machinery. ","SoftBank's service to help power self-driving buses, farm machinery"
,"June 3, 2019 /  1:04 PM / Updated 6 hours ago",LONDON (Reuters) - U.S. President Donald Trump is visiting Britain this week on a state visit and is likely to urge the government to decide against allowing Chinese company Huawei to take part in its 5G telecoms infrastructure. ,Where do Britain's candidates for prime minister stand on Huawei?
,"June 3, 2019 /  1:49 PM / Updated 5 hours ago",(Reuters) - Chipmaker Advanced Micro Devices shares rose 7 percent in early trading on Monday after the company announced a deal with Samsung Electronics Co Ltd that could allow it to better compete with Nvidia Corp. ,AMD shares rise on mobile graphics tie-up with Samsung
"Sarah N. Lynch,Andy Sullivan","May 29, 2019 /  1:49 PM / 4 days ago",WASHINGTON (Reuters) - U.S. Special Counsel Robert Mueller said on Wednesday his probe into Russian interference in the 2016 election was never going to end with criminal charges against President Donald Trump but he did not clear him and indicated it was up to Congress to decide whether he should be impeached. ,Mueller says he could not charge Trump as Congress weighs impeachment
,"May 30, 2019 /  1:48 AM / 4 days ago", (The May 29 story corrects ship’s namesake in paragraph 5) ,Trump says he was not told of request to move USS John McCain 'out of sight'
,"June 3, 2019 /  7:34 AM / Updated 6 hours ago","LONDON (Reuters) - Britain takes careful notice of what the United States says on the risks of using Huawei in 5G networks and does not want to be overly dependent on a third country for certain technologies, Foreign Secretary Jeremy Hunt said on Monday. ","Britain listens to the United States on Huawei, foreign minister says"
,"May 30, 2019 /  7:50 AM / 4 days ago","BEIJING (Reuters) - China is willing to meet reasonable demand for rare earths from other countries, but it would be unacceptable that countries using Chinese rare earths to manufacture products would turn around and suppress China, its commerce ministry said.  ",China willing to meet reasonable rare earth demand from other countries
Foo Yun Chee,"June 3, 2019 /  2:04 PM / Updated 5 hours ago","PARIS (Reuters) - EU regulators will decide what steps to take regarding Spotify’s complaint about Apple once they get a response from the iPhone maker, Europe’s antitrust chief said on Monday. ",EU wants to hear from Apple over Spotify complaint
