author,datePublished,summary,title,"April 5, 2019 /  6:52 PM / 2 months ago","UNITED NATIONS (Reuters) - U.S. Vice President Mike Pence will address the United Nations Security Council next week on Venezuela, a White House official said on Friday, as the 15-member body remains deadlocked over how to deal with the country’s political and humanitarian crisis.  ",Pence to address U.N. Security Council on Venezuela next week
Sarah N. Lynch,"April 4, 2019 /  6:38 PM / 2 months ago","WASHINGTON (Reuters) - FBI Director Chris Wray on Thursday defended the Trump administration’s decision to abandon plans to relocate the bureau’s crumbling and outdated headquarters to Virginia or Maryland, saying he prefers to build a new state-of-the-art facility at its current location in downtown Washington, D.C. ",FBI head says agency has no desire to move its headquarters
"Mark Hosenball,Susan Cornwell","April 3, 2019 /  9:17 PM / 2 months ago",WASHINGTON (Reuters) - Congressional Democrats raised questions on Wednesday about security at President Donald Trump’s Mar-a-Lago resort in Florida after a Chinese woman carrying electronic devices bluffed her way through security checks last weekend. ,U.S. Democrats question Mar-a-Lago security after Chinese intruder
"Kane Wu,Hyunjoo Jin","April 11, 2019 /  11:08 PM / 2 months ago",HONG KONG/SEOUL (Reuters) - The sale of a controlling stake in the parent of South Korean gaming firm Nexon Co is now narrowing to a handful of serious bidders after generating fevered speculation.   ,Explainer: Who is in the driver's seat in battle for South Korean gaming giant Nexon?
,"April 3, 2019 /  10:39 PM / 2 months ago","WASHINGTON (Reuters) - U.S. President Donald Trump said on Wednesday he was not worried about Chinese espionage at Mar-a-Lago, after the Secret Service arrested a Chinese woman who had passed security checkpoints at the Florida resort carrying a thumb drive with malicious software. ",Trump says not concerned about China spying at his Florida resort
"Amanda Becker,Richard Cowan","April 3, 2019 /  10:09 PM / 2 months ago",WASHINGTON (Reuters) - The Republican-led U.S. Senate on Wednesday changed its procedures to speed up the confirmation of President Donald Trump’s nominees for some lower court judgeships and sub-Cabinet level positions. ,U.S. Senate Republicans change procedures to speed up Trump confirmations
Heather Somerville,"April 12, 2019 /  3:13 AM / 2 months ago","SAN FRANCISCO (Reuters) - SoftBank Group Corp has agreed to give up board seats and access to sensitive information, take a more passive role in startups and make other concessions to get government clearance for its technology deals in the United States. ",SoftBank picking its battles with U.S. national security committee
"Makiko Yamazaki,Arjun Panchadar","April 11, 2019 /  9:52 AM / 2 months ago","TOKYO/BENGALURU (Reuters) - Panasonic Corp and Tesla Inc will continue to make new investments in the U.S. electric carmaker’s Gigafactory as needed, but believe they can squeeze more out of existing resources than previously planned, Tesla said on Thursday. ","Tesla, Panasonic to seek productivity gains before new battery investments"
,"April 12, 2019 /  12:05 AM / in 2 months",(Reuters) - Uber Technologies Inc’s initial public offering filing on Thursday contains data that will be key to selling itself to investors. ,Factbox: How Uber and Lyft compare on key financial metrics
Joshua Franklin,"April 11, 2019 /  8:24 PM / 2 months ago","NEW YORK (Reuters) - Uber Technologies Inc has 91 million users, but growth is slowing and it may never make a profit, the ride-hailing company said on Thursday in its IPO filing. ",Uber unveils IPO with warning it may never make a profit
,"April 12, 2019 /  3:43 AM / 2 months ago","(Reuters) - Tesla Inc on Thursday started leasing out its Model 3 sedan in the United States, in a financing option that would increase the electric car maker’s customer base. ",Tesla begins offering leases for Model 3
Lisa Baertlein,"April 12, 2019 /  4:24 AM / 2 months ago","LOS ANGELES (Reuters) - Uber Technologies Inc’s restaurant delivery business has grown revenue to $1.5 billion in just three years, the company disclosed in its IPO filing on Thursday, dwarfing the revenue of its profitable, and already public, rival Grubhub Inc. ","Uber filing lists revenue gains, struggles of food business"
,"April 12, 2019 /  5:43 AM / 2 months ago","SINGAPORE (Reuters) - A mutual health aid plan launched by Ant Financial Services Group, the dominant fintech player in China, has amassed more than 50 million users and is aiming for 300 million within two years, the company said late on Thursday.  ","China's Ant Financial amasses 50 million users, mostly low-income, in new health plan"
Brenda Goh,"April 12, 2019 /  1:43 AM / 2 months ago","SHANGHAI (Reuters) - China’s largest stock images provider, Visual China Group, shut its website and apologized on Friday after it falsely claimed copyright of images such as the first photo of a black hole and China’s national flag. ",Furor over 'black hole' photo forces China's largest image provider to shut
Arlene Washington,"April 4, 2019 /  5:24 PM / 2 months ago",(Reuters) - The largest Democratic field in the modern political era is lining up to seek the party’s 2020 presidential nomination - and is expected to keep growing. ,Factbox: Big Democratic field taking shape for 2020 U.S. presidential race
,"April 11, 2019 /  4:12 PM / 2 months ago","FRANKFURT (Reuters) - German car parts makers Benteler and Freudenberg Vibracoustic are joining forces in the development of parts for electric vehicles, the companies said on Thursday, amid a growing trend of companies in the sector cooperating to cope with change. ","Suppliers Freudenberg, Benteler join forces in electric cars"
Joey Roulette,"April 11, 2019 /  11:18 PM / in 2 months","(Reuters) - The most powerful operational rocket in the world, SpaceX’s Falcon Heavy, launched its first commercial mission on Thursday from Florida in a key demonstration for billionaire entrepreneur Elon Musk’s space company in the race to grasp lucrative military launch contracts. ",Elon Musk's SpaceX sends world's most powerful rocket on first commercial flight
,"April 11, 2019 /  12:15 PM / 2 months ago","SHEPTON MALLET, England (Reuters) - They may look like regular cows, but a herd of Friesian dairy cattle at a British farm are internet pioneers and they are enjoying the benefits of 5G connectivity before you. ",5G-connected cows test milking parlor of the future
"Heather Somerville,Paul Lienert","April 12, 2019 /  1:06 AM / in 2 months",(Reuters) - SoftBank Group Corp leader Masayoshi Son has much bigger ambitions for transportation than simply seeing his investment in Uber Technologies Inc turn into more than $13 billion when the company goes public next month.  ,Inside SoftBank's push to rule the road
John Whitesides,"April 4, 2019 /  3:23 PM / 2 months ago","(Reuters) - U.S. Representative Tim Ryan, a moderate Ohio Democrat from a blue-collar district who touts his appeal to the working-class voters who fled the party in 2016, said on Thursday he will enter the 2020 White House race. ",Congressman Tim Ryan of Ohio joins crowded Democratic field in 2020 White House race
,"April 11, 2019 /  10:07 AM / 2 months ago","LOS ANGELES (Reuters) - Walt Disney Co unveiled new details on Thursday about Disney+, a family-friendly digital video subscription that is set to debut later this year and compete with Netflix Inc.  ","Marvel, monsters and 'Mandalorian' coming to Disney+ app"
Makiko Yamazaki,"April 12, 2019 /  8:29 AM / 2 months ago",TOKYO (Reuters) - A Chinese-Taiwanese group will take control of Apple Inc supplier Japan Display after pumping in funds as part of a 232 billion yen ($2.1 billion) bailout plan for the troubled display panel maker. ,Chinese group to get control of Japan Display after $2.1 billion bailout
Hilary Russ,"April 12, 2019 /  1:56 AM / 2 months ago","NEW YORK (Reuters) - ESPN+, Walt Disney Co’s sports video streaming service, could attract between 8 million and 12 million paying subscribers by the end of the fiscal 2024 year, the company said on Thursday. ",Disney sees ESPN+ reaching up to 12 million subscribers by 2024
Josh Horwitz,"April 12, 2019 /  11:35 AM / in 2 months","SHANGHAI (Reuters) - Alibaba Group founder and billionaire Jack Ma has defended the grueling overtime work culture at many of China’s tech companies, calling it a “huge blessing” for young workers. ",Alibaba founder defends overtime work culture as 'huge blessing'
,"April 12, 2019 /  3:27 PM / 2 months ago",NEW YORK (Reuters) - (Backstory is a series of reports showing how Reuters journalists work and the standards under which they operate) ,"Backstory: Three cameras, two ladders - snapping Tesla's Elon Musk at court"
,"April 12, 2019 /  2:14 PM / 2 months ago","AMSTERDAM (Reuters) - Dutch Prime Minister Mark Rutte on Friday said his government is exploring how to design the construction of a 5G telecoms network, but has no opinion yet on the possible role of Chinese technology companies in this. ",Dutch PM Rutte: no decisions yet on Chinese role in 5G roll out
,"April 12, 2019 /  12:59 PM / 2 months ago","MOSCOW (Reuters) - A court in Russia fined Facebook on Friday for failing to tell authorities where it stores Russian user data, Russian news agencies reported, a ruling that highlights wrangling between tech giants and Moscow as it ramps up Internet controls.  ",Russia finds Facebook failed to provide information on data-agencies
,"April 5, 2019 /  1:35 PM / 2 months ago",WASHINGTON (Reuters) - President Donald Trump said on Friday he is considering an economic penalty apart from tariffs to counter the smuggling of drugs from Mexico across the southern U.S. border. ,Trump: looking at economic penalty for drugs coming from Mexico
,"April 9, 2019 /  4:08 PM / 2 months ago",WASHINGTON (Reuters) - Two U.S. senators introduced a bill on Tuesday to ban online social media companies like Facebook Inc and Twitter Inc from tricking consumers into giving up their personal data. ,U.S. senators introduce social media bill to ban 'dark patterns' tricks
"Milton Castillo,Daina Beth Solomon","April 5, 2019 /  5:27 AM / in 2 months","SANTA MARIA CHIQUIMULA, Guatemala (Reuters) - After a U.S.-funded program gave Guatemalan farmer Rigoberto Leon and his neighbors tools to plant new crops like tomatoes and chili peppers, many of them stayed to live off their drought-prone lands even as droves of villagers left for the United States. ",U.S. aid helped Guatemalan farmers stay rooted to their lands
"Josh Horwitz,Brenda Goh","April 13, 2019 /  9:10 AM / 2 months ago","SHANGHAI (Reuters) - Richard Liu, the founder of Chinese e-commerce giant JD.com Inc, has weighed in on an ongoing debate about the Chinese tech industry’s grueling overtime work culture, lamenting that years of growth had increased the number of “slackers” in his firm who are not his “brothers.”  ",China's JD.com boss criticizes 'slackers' as company makes cuts
Dan Whitcomb,"April 14, 2019 /  12:32 AM / 2 months ago","LOS ANGELES (Reuters) - The world’s largest aircraft took off over the Mojave Desert in California on Saturday, the first flight for the carbon-composite plane built by Stratolaunch Systems Corp, started by late Microsoft co-founder Paul Allen, as the company enters the lucrative private space market.  ",World's largest plane makes first flight over California
,"April 14, 2019 /  11:53 AM / 2 months ago","(Reuters) - Facebook Inc said it restored services on Sunday after some users could not access its social networking site, photo-sharing network Instagram and messaging app WhatsApp. ","Facebook, Instagram and WhatsApp working again after outages"
Anna Irrera,"April 15, 2019 /  5:07 AM / 2 months ago","NEW YORK (Reuters) - U.S. online lenders such as LendingClub Corp, Kabbage Inc and Avant LLC are scrutinizing loan quality, securing long-term financing and cutting costs, as executives prepare for what they fear could be the sector’s first economic downturn. ","Worried a recession is coming, U.S. online lenders reduce risk"
Imani Moise,"April 14, 2019 /  10:52 PM / 2 months ago","NEW YORK (Reuters) - Lyft Inc is removing several thousand electric bikes from service in its bike-share program in New York, Washington and San Francisco because of a braking problem, the ride-hailing company said on Sunday.  ",Lyft pulls electric bikes in three U.S. cities after complaints about braking
Edward Taylor,"April 15, 2019 /  6:09 AM / 2 months ago","FRANKFURT (Reuters) - Rene-Christopher Wollmann, head of Mercedes-AMG’s 2.75 million euros Project One supercar program, has moved to a job at Automobili Pininfarina in a sign that innovation in high end electric sportscars is shifting toward small start-ups. ","In quest for electric supercars, engineers head to start-ups"
,"April 15, 2019 /  5:21 AM / 2 months ago","SHANGHAI (Reuters) - Volkswagen expects global sales of its core brand this year to be in line with the 6.24 million level that it achieved in 2018 even though China sales dipped in the first-quarter, the company said on Monday. ",Volkswagen expects core brand's global 2019 sales to be in line with last year: senior executive
"Steve Holland,Ann Saphir","April 4, 2019 /  4:45 PM / 2 months ago","(Reuters) - U.S. President Donald Trump plans to nominate former pizza chain executive and Republican presidential candidate Herman Cain for a seat on the Federal Reserve Board, where he will help set interest rates for the world’s biggest economy.  ",Trump picks former presidential candidate Cain for Fed board
,"April 15, 2019 /  3:40 AM / 2 months ago","SHANGHAI (Reuters) - Volkswagen is pushing its joint venture partners including SK Innovation (SKI) to build electric car battery plants which have at least one Gigawatt manufacturing capacity, Chief Executive Herbert Diess told Reuters. ",Volkswagen pushes battery partners to build Gigafactories
"Alun John,Sumeet Chatterjee","April 15, 2019 /  12:49 AM / 2 months ago","HONG KONG (Reuters) - Asia’s internet firms are challenging the region’s traditional banks for consumer finances, tapping their massive user networks for business and following a trail blazed in China by tech giants Alibaba and Tencent. ",Asia's tech champions zero in on main street banking
,"April 12, 2019 /  4:09 PM / 2 months ago","GENEVA (Reuters) - China told Australia at the World Trade Organization on Friday that Australia’s restriction on Chinese 5G telecoms technology was “obviously discriminative” and appeared to break global trade rules, according to a transcript seen by Reuters.  ",China warns Australia at WTO about 5G restriction
Suzanne Barlyn,"April 12, 2019 /  4:39 PM / in 2 months",NEW YORK (Reuters) - The new chief of New York State’s financial services regulator on Friday said she is concerned that the complex technology used by banks and insurers to make business decisions could inadvertently discriminate against some consumers. ,"Financial technology at banks, insurers could inadvertently discriminate: N.Y. regulator"
,"April 12, 2019 /  6:54 PM / 2 months ago","(Reuters) - California regulators on Friday proposed regulations that would allow vehicle manufacturers to test or deploy small self-driving delivery trucks on public roads, the state’s Department of Motor Vehicles (DMV) said in a statement. ",California proposes steps to allow small self-driving delivery trucks on roads
,"April 5, 2019 /  12:05 AM / 2 months ago","(Reuters) - U.S. President Donald Trump’s former lawyer Michael Cohen has received requests for information from at least six government entities since late February, according to a letter from Cohen’s attorney to Democratic lawmakers, a sign of ongoing interest in evidence Cohen may have on his former boss.  ",Former Trump lawyer Cohen says assisting with more probes
,"April 12, 2019 /  5:14 PM / 2 months ago",(Reuters) - Shares of Walt Disney Co touched an all-time high on Friday after Wall Street analysts said the aggressive pricing of its new video streaming service could help it better compete with Netflix Inc.  ,Disney hits record on streaming plans; Netflix slips
Foo Yun Chee,"April 12, 2019 /  6:19 PM / 2 months ago","BRUSSELS (Reuters) - EU countries are set to agree an overhaul of the bloc’s two-decade old copyright rules next week, requiring Google to pay publishers for news snippets and Facebook to filter out protected content, despite increasing opposition from some governments. ","EU copyright revamp targeting Google, Facebook set for approval on Monday"
,"April 4, 2019 /  8:42 PM / 2 months ago",WASHINGTON (Reuters) - U.S. President Donald Trump said on Thursday a trade deal with China was getting very close and could be reached in about four weeks. ,Trump says trade deal with China could be reached in about four weeks
David Shepardson,"April 12, 2019 /  3:19 PM / 2 months ago",WASHINGTON (Reuters) - President Donald Trump said Friday the United States should not nationalize its 5G network and said private companies should move quickly to deploy the faster next-generation network. ,Trump says he opposes nationalizing U.S. 5G network
Diane Bartz,"April 11, 2019 /  10:38 PM / 2 months ago","WASHINGTON (Reuters) - U.S. Senator Mark Warner, who co-sponsored legislation this week to ban deceptive practices by social media companies, said on Thursday he was eyeing additional bills aimed at limiting hate speech and allowing users to move their data across platforms.  ","U.S. Senator Warner eyes social media bills for hate speech, data portability"
Lisa Richwine,"April 11, 2019 /  10:07 AM / 2 months ago","BURBANK, Calif. (Reuters) - Walt Disney Co priced its highly anticipated streaming video service below Netflix in an aggressive move to challenge the dominant streaming service and entice families to buy yet another monthly subscription. ","Disney unveils price, launch date for big streaming push"
,"April 12, 2019 /  8:54 PM / 2 months ago","(Reuters) - Facebook Inc more than doubled the money it spent on Chief Executive Officer Mark Zuckerberg’s security in 2018 to $22.6 million, a regulatory filing showed on Friday. ",Facebook spends $22.6 million to keep Mark Zuckerberg safe
,"April 15, 2019 /  9:21 AM / 2 months ago",AMSTERDAM (Reuters) - The Dutch government on Monday said it had established a special task force to weigh potential security risks as it prepares to build a 5G telecommunications network. ,The Netherlands forms task force to assess 5G security risks
Sarah N. Lynch,"April 5, 2019 /  4:40 PM / 2 months ago","WASHINGTON (Reuters) - U.S. Attorney General William Barr said he was ordering certain Justice Department offices to investigate possible discrimination targeting gay, lesbian, bisexual and transgender employees after an internal gay affinity group complained of low morale. ",U.S. attorney general orders probe into mistreatment of gay employees
Sergio Goncalves,"April 15, 2019 /  11:06 AM / 2 months ago","LISBON (Reuters) - At a time when a slowing global economy is seen as a threat to Portugal’s growth, the country is betting on a new artificial intelligence platform to help companies boost their exports.  ",Portugal bets on artificial intelligence to boost exports
Foo Yun Chee,"April 15, 2019 /  8:36 AM / 2 months ago",BRUSSELS (Reuters) - Google will have to pay publishers for news snippets and Facebook filter out protected content under new copyright rules aimed at ensuring fair compensation for the European Union’s $1 trillion creative industries. ,"EU approves tougher EU copyright rules in blow to Google, Facebook"
,"April 15, 2019 /  11:26 AM / 2 months ago","BERLIN (Reuters) - Workers at four Amazon logistic centers in Germany went on strike on Monday, the latest action in a long-running campaign for better pay and conditions. ",Amazon workers strike at four German warehouses
,"April 15, 2019 /  12:21 PM / 2 months ago",(Reuters) - Digital printing company Electronics For Imaging Inc said on Monday private equity firm Siris Capital Group LLC would buy the company for about $1.6 billion in cash. ,Siris Capital to buy Electronics For Imaging for $1.6 billion
Norihiko Shirouzu,"April 15, 2019 /  9:05 AM / 2 months ago","BEIJING (Reuters) - Toyota Motor Corp has agreed to sell electric car technology to Singulato, its first deal with a Chinese electric vehicle startup, allowing the fledgling firm to speed up development of a planned mini EV. ",Exclusive: Toyota sells electric vehicle technology to Chinese startup Singulato
,"April 15, 2019 /  1:56 PM / 2 months ago",BRUSSELS (Reuters) - Belgium’s center for cybersecurity has found no evidence that telecoms equipment supplied by Huawei Technology could be used for spying. ,Belgian cybersecurity agency finds no threat from Huawei
"Johannes Hellstrom,Esha Vaish","April 15, 2019 /  12:06 PM / 2 months ago","STOCKHOLM (Reuters) - Sweden’s Veoneer expects to gain from a commercial delay in self-driving cars, betting that rising demand for its radar and camera-based systems as the industry ramps up to autonomy will boost its market position. ",Sweden's Veoneer bets driverless car delay will be its gain
Stephen Nellis,"April 15, 2019 /  11:01 AM / 2 months ago","(Reuters) - Apple Inc and its allies on Monday will kick off a jury trial against chip supplier Qualcomm Inc in San Diego, alleging that Qualcomm engaged in illegal patent licensing practices and seeking up to $27 billion in damages.  ","Apple, allies seek billions in U.S. trial testing Qualcomm's business model"
,"April 15, 2019 /  12:11 PM / 2 months ago","SHANGHAI (Reuters) - Volkswagen will use Chinese software developers to help design a global autonomous vehicle architecture thanks to the prevalence of qualified programmers which carmakers are struggling to hire elsewhere, senior executives said on Monday. ",VW says China to become global software development hub to autonomous tech
David Morgan,"April 3, 2019 /  5:06 AM / 2 months ago","WASHINGTON (Reuters) - U.S. congressional Democrats on Wednesday authorized a powerful committee chairman to subpoena Special Counsel Robert Mueller’s full report on Russia’s role in the 2016 election, moving closer to a legal clash with President Donald Trump’s administration. ","Democrats in Congress authorize subpoenas for Trump-Russia report, legal battle looms"
Gina Cherelus,"April 8, 2019 /  1:13 PM / 2 months ago","(Reuters) - The Baltimore City Council on Monday called on Mayor Catherine Pugh to resign as the state probes a deal in which a hospital chain where she served as director paid her $500,000 for copies of her self-published children’s book “Healthy Holly.” ","Baltimore city council urges mayor to resign amid probe into $500,000 book payment"
"Anna Koper,Joanna Plucinska","April 16, 2019 /  9:27 AM / 2 months ago","WARSAW (Reuters) - Poland is unlikely to exclude all Huawei equipment from its next generation mobile networks, a government minister told Reuters, in part to avoid increased costs for mobile operators. ",Poland to hold off blanket ban on Huawei 5G gear due to cost concerns
"Patricia Zengerle,Diane Bartz","April 7, 2019 /  9:41 PM / 2 months ago","WASHINGTON (Reuters) - U.S. Homeland Security Secretary Kirstjen Nielsen, who oversaw President Donald Trump’s bitterly contested immigration policies during her tumultuous 16-month tenure, resigned on Sunday amid a surge in the number of migrants at the border with Mexico. ",Homeland Security Secretary Nielsen resigns amid Trump anger over border
,"April 16, 2019 /  10:13 AM / 2 months ago","MOSCOW (Reuters) - Twitter and Facebook have nine months to comply with data law by moving Russian user data onto servers in Russia, Interfax cited communications watchdog head Alexander Zharov as saying on Tuesday.     ","Russia: Twitter, Facebook have nine months to comply with data law - Ifax"
Anna Irrera,"April 16, 2019 /  11:08 AM / 2 months ago","NEW YORK (Reuters) - New York-based cryptocurrency compliance startup Chainalysis has raised $6 million in funding from Japanese financial group Mitsubishi UFJ Financial Group Inc and venture capital firm Sozo Ventures, the company said on Tuesday. ","Crypto compliance startup Chainalysis raises funding from MUFG, Sozo Ventures"
,"April 16, 2019 /  3:56 AM / 2 months ago",(Reuters) - Foxconn’s Chairman Terry Gou said on Tuesday he is considering contesting Taiwan’s 2020 presidential election and the company said he would withdraw from the daily operations of the world’s largest contract manufacturer. ,"Foxconn chairman to withdraw from daily operations, considers presidential run"
,"April 16, 2019 /  10:03 AM / 2 months ago","MILAN (Reuters) - Italy’s antitrust authority said on Tuesday it had launched a probe into five Amazon companies for possible abuse of dominant market position in e-commerce and logistical services.    It said the probe had been launched into Amazon Services Europe, Amazon Europe Core, Amazon EU, Amazon Italia Services and Amazon Italia Logistica. ",Italy's competition watchdog launches probe into five Amazon companies
,"April 16, 2019 /  11:18 AM / 2 months ago","BENGALURU (Reuters) - Indian software services exporter Wipro Ltd missed analyst estimates for fourth-quarter profit on Tuesday, partly hurt by a rise in expenses and forecast weak growth at its biggest business segment. ",India's Wipro misses fourth-quarter profit estimates
