author,datePublished,summary,title,"May 24, 2019 /  8:25 PM / 10 days ago","WASHINGTON (Reuters) - U.S. President Donald Trump, engaged in personal attacks on House of Representatives Speaker Nancy Pelosi, retweeted a heavily edited video that falsely claimed the Democratic leader had difficulty speaking to reporters. ",Trump retweets doctored video of Pelosi to portray her as having 'lost it'
Stephen Nellis,"May 29, 2019 /  5:33 AM / 6 days ago","(Reuters) - Taiwan-based chip supplier MediaTek Inc on Wednesday released a new 5G chip for fast, high-end smartphones that aims to take on much larger rival Qualcomm Inc. ",MediaTek aims to take on Qualcomm with new 5G chip
Sam Nussey,"May 29, 2019 /  1:55 AM / 6 days ago","TOKYO (Reuters) - Japan’s the Pokemon Company said on Wednesday it was developing “Pokemon Sleep”, a mobile app that tracks players’ sleep and uses the data for gameplay, with a release date set for next year. ",Gotta catch 'em snores: Pokemon sleep app to launch next year
Steve Scherer,"May 28, 2019 /  5:30 PM / 6 days ago","OTTAWA (Reuters) - Canadian lawmakers fumed on Tuesday when Facebook Inc founder and Chief Executive Mark Zuckerberg snubbed an invitation to Ottawa to testify on privacy and democracy before an international panel, slapping the billionaire with a standing summons. ",Canadian lawmakers fume after Facebook's Zuckerberg snubs invitation
,"May 29, 2019 /  7:01 AM / 6 days ago","HELSINKI (Reuters) - Finland’s Uros, a little known Internet of Things services company, saw its sales soar 171% to 1.31 billion euros last year and could become Finland’s next tech star after Nokia, Finnish business weekly Talouselama reported on Wednesday. ",Finnish IoT company Uros' sales soar 171% last year: report
,"May 29, 2019 /  8:06 AM / 6 days ago","JERUSALEM (Reuters) - Santa Clara-based Palo Alto Networks has acquired Israeli cybersecurity firm Twistlock, Israeli financial news websites reported on Wednesday. ",Palo Alto buys Israeli cybersecurity firm Twistlock: report
"Ju-min Park,Heekyong Yang","May 29, 2019 /  3:31 AM / 6 days ago","SEOUL (Reuters) - Less than a week after Huawei Technologies was blacklisted by the United States, more than a hundred South Korean politicians and business leaders toured the Chinese tech giant’s headquarters and its lavish new campus outside Shenzhen. ",Huawei ban puts South Korea in a familiar place: caught between the U.S. and China
,"May 29, 2019 /  10:23 AM / 5 days ago","WASHINGTON (Reuters) - Rare earth elements are used in a wide range of consumer products, from iPhones to electric car motors, as well as military jet engines, satellites and lasers. ",Explainer: China's rare earth supplies could be vital bargaining chip in U.S. trade war
James Oliphant,"May 28, 2019 /  9:35 PM / 5 days ago","WASHINGTON (Reuters) - Former U.S. Vice President Joe Biden, the front-runner for the 2020 Democratic presidential nomination, on Tuesday released an education plan aimed at boosting teacher pay and reducing the funding gap between wealthy and low-income public schools.  ","Biden education plan would boost U.S. teacher pay, ban assault weapons"
Sankalp Phartiyal,"May 29, 2019 /  1:16 PM / 5 days ago","MUMBAI (Reuters) - Samsung Electronics aims to double its online smartphone sales in India this year to $1 billion, driven largely by a new budget range of devices, the head of its mobile business for the country said on Wednesday. ",Samsung aims to double online smartphone sales in India
"Amanda Becker,Tim Reid","May 28, 2019 /  6:51 PM / 6 days ago","SPARTANBURG, S.C./LOS ANGELES (Reuters) - Democratic presidential candidate Kamala Harris unveiled a new plan to protect abortion access on Tuesday, joining fellow White House hopefuls pushing back against Republican-backed state laws that restrict a woman’s right to end a pregnancy. ",U.S. presidential hopeful Harris unveils plan to protect abortion rights
Tim Reid,"May 29, 2019 /  11:06 AM / 5 days ago",LOS ANGELES (Reuters) - Democratic presidential candidate Beto O’Rourke proposed a new immigration plan on Wednesday that will allow churches and local communities to sponsor immigrants to the United States in becoming American citizens. ,"Democrat O'Rourke unveils ""community-based"" immigration plan"
,"May 29, 2019 /  10:28 AM / 5 days ago","WASHINGTON (Reuters) - Secretary of State Mike Pompeo kept up U.S. pressure on Huawei Technologies Co Ltd on Wednesday, saying the Chinese tech giant takes orders from Beijing. ",U.S.'s Pompeo says Huawei is an 'instrument of Chinese government'
,"May 29, 2019 /  1:56 PM / 5 days ago","(Reuters) - Amazon.com Inc on Wednesday launched a smaller version of the company’s Echo Show smart speaker, which is powered by its popular voice assistant Alexa. ",Amazon launches smaller Echo Show device for $90
,"May 29, 2019 /  12:51 PM / 5 days ago",(Reuters) - Dutch chipmaker NXP Semiconductors NV said on Wednesday it will buy Marvell Technology Group Ltd’s wireless connectivity business for $1.76 billion in cash to offer its customers a bigger product portfolio. ,"NXP to buy Marvell's WiFi, Bluetooth business for $1.76 billion"
,"May 29, 2019 /  3:43 PM / in 5 days","(Reuters) - Cypress Semiconductor Corp is exploring options, including a potential sale, after receiving takeover interest, Bloomberg reported on Wednesday, citing people familiar with the matter. ",Cypress Semiconductor explores options after receiving takeover interest: Bloomberg
Sijia Jiang,"May 29, 2019 /  2:56 AM / 5 days ago","HONG KONG (Reuters) - China’s Huawei Technologies Co Ltd has filed a legal motion seeking to declare a U.S. defense law unconstitutional, in the telecom equipment maker’s latest bid to fight sanctions from Washington that threaten to push it out of global markets. ",Huawei challenges U.S. defense bill as sanctions fight ramps up
,"May 29, 2019 /  6:01 PM / 5 days ago",SAO PAULO (Reuters) - Brazilian electric engineering company WEG SA said on Wednesday it had signed an agreement with Brazil’s planemaker Embraer SA  to develop new technology for electrical propulsion systems for aircraft. ,"Embraer, WEG team up to build electric motor for planes: statement"
Paul Lienert,"May 29, 2019 /  3:55 PM / 5 days ago","(Reuters) - U.S. demand for electric vehicles, including hybrids, could rise to 1.28 million by 2026, a new study projected on Wednesday, but most brands will struggle to make money on the new models. ","Outside of Tesla, future EV sales in U.S. may be thin for most brands: study"
,"May 29, 2019 /  7:00 PM / 5 days ago",(Reuters) - Apple Inc on Wednesday publicly defended its App Store from mounting criticism over its treatment of rivals in a new blog post detailing its functions and guidelines. ,Apple defends App Store amid mounting criticism
,"May 29, 2019 /  8:31 PM / 5 days ago","(Reuters) - Cybersecurity company Palo Alto Networks Inc forecast current-quarter profit below analysts’ estimates on Wednesday, largely due to expenses related to its recent acquisitions and a hit from tariffs, sending its shares down 5%. ","Palo Alto Networks forecasts current-quarter profit below estimates, shares fall"
,"May 29, 2019 /  7:46 PM / 5 days ago","(Reuters) - Tesla Inc has “a lot of catching up” to do but still can achieve a record quarter, Chief Executive Officer Elon Musk wrote in a new email that was reviewed by Reuters. ",Tesla CEO urges employees to 'catch up' to hit delivery record
,"June 3, 2019 /  9:30 PM / Updated 18 minutes ago","WASHINGTON (Reuters) - The top U.S. law enforcement officer and the Commerce secretary will face a contempt of Congress vote unless they hand over documents by Thursday on efforts to put a citizenship question on the 2020 Census, the chairman of a House of Representatives panel warned on Monday. ","House panel threatens contempt of Congress vote against Barr, Ross"
,"May 29, 2019 /  9:42 PM / 5 days ago","HAVANA (Reuters) - Cuba announced on Wednesday it would legalize private Wi-Fi networks to access the internet and connect computers, as well as allow imports of equipment like routers in another step toward expanding connectivity on the Communist-run island. ",Cuba legalizes private Wi-Fi networks in bid to boost connectivity
Stephen Nellis,"June 3, 2019 /  11:04 AM / Updated 4 hours ago","SAN JOSE, Calif. (Reuters) - Apple Inc on Monday launched a “Sign In With Apple” function to rival Facebook and Google web login accounts, drawing a contrast with rivals by stressing protection of users’ information. ","Apple challenges Google, Facebook for web login, touts privacy"
,"June 3, 2019 /  6:48 PM / Updated 4 hours ago",Shares of Apple Inc were down nearly 3% in afternoon trading on Mon following a Reuters report that the U.S. Dept of Justice was given jurisdiction to include the iPhone maker as part of broader antitrust probe. ,Apple dips on news of DoJ antitrust probe
Noel Randewich,"June 3, 2019 /  7:02 PM / Updated 3 hours ago","SAN FRANCISCO (Reuters) - With the quiet period related to Uber Technologies disastrous IPO last month coming to an end, investors can expect a deluge of analyst research initiations on the ride-hailing service. ",Deluge of analyst reports on Uber expected after IPO quiet period
"Alexandra Alper,Frank Jack Daniel","June 3, 2019 /  12:05 PM / a minute ago","WASHINGTON/MEXICO CITY (Reuters) - Mexico on Monday said it would reject a U.S. idea to take in all Central American asylum seekers if it is raised at talks this week with Trump administration, which has threatened to impose tariffs if Mexico does not crack down on illegal immigration.  ",Mexico draws red line on asylum before talks on Trump's tariff threat
,"June 3, 2019 /  5:44 PM / Updated 2 hours ago","WASHINGTON (Reuters) - The U.S. Justice Department has jurisdiction for a potential probe of Apple Inc as part of a broader review of whether technology giants are using their size to act in an anti-competitive manner, two sources told Reuters. ",Exclusive: U.S. Justice Dept considering Apple probe - sources
,"June 3, 2019 /  9:20 PM / Updated 2 hours ago",WASHINGTON (Reuters) - The U.S. House of Representatives Judiciary Committee said on Monday it had started a bipartisan investigation into competition in digital markets. ,House panel to probe competition in digital markets
Hilary Russ,"June 3, 2019 /  9:40 PM / Updated an hour ago",NEW YORK (Reuters) - Live sports streaming service FloSports said on Monday that it raised $47 million from investors including current partner Discovery Inc. to grow its coverage of new and existing sports. ,"Streaming sports site FloSports raises $47 million, led by Discovery"
,"June 3, 2019 /  4:03 PM / Updated 5 hours ago","(Reuters) - The Federal Trade Commission (FTC) has secured the right to examine how Facebook Inc’s practices affect its digital competition, the Wall Street Journal reported on Monday. ",FTC wins right for competition probe at Facebook: WSJ
"Paresh Dave,Diane Bartz","June 3, 2019 /  8:49 PM / Updated 2 hours ago",SAN FRANCISCO/WASHINGTON (Reuters) - Ad tech firms and publishers have had to stay in the good graces of Google or risk insolvency. ,"U.S. probe of Google's online ad dominance would appease long suffering rivals, publishers"
,"June 3, 2019 /  4:07 PM / Updated 2 hours ago",(Reuters) - Alphabet Inc’s shares closed 6% down on Monday following reports that the U.S. Justice Department may investigate Google for hampering competition. ,Alphabet shares slide 6% on possible DoJ antitrust probe
"Diane Bartz,Jan  Wolfe","June 3, 2019 /  7:00 PM / Updated 4 minutes ago","WASHINGTON (Reuters) - The U.S. government is gearing up to investigate whether Amazon, Apple, Facebook and Google misuse their massive market power, sources told Reuters on Monday, setting up what could be an unprecedented, wide-ranging probe of some of the world’s largest companies. ",U.S. moving toward major antitrust probe of tech giants
Daniel Trotta,"May 14, 2019 /  10:28 AM / 20 days ago","(Reuters) - Alabama’s state Senate passed a bill on Tuesday to outlaw nearly all abortions, creating exceptions only to protect the mother’s health, as part of a multistate effort to have the U.S. Supreme Court reconsider a woman’s constitutional right to an abortion. ","Alabama Senate bans nearly all abortions, including rape cases"
Sofia Menchu,"May 16, 2019 /  4:57 AM / 19 days ago","WASHINGTON (Reuters) - A 2-1/2-year-old Guatemalan migrant boy who was detained last month at the U.S.-Mexico border but released from U.S. custody with his mother during treatment for an illness has died in hospital, authorities said on Wednesday. ",Guatemalan migrant toddler dies weeks after U.S. detention
Joseph Ax,"May 15, 2019 /  3:54 PM / 19 days ago","NEW YORK (Reuters) - Andrew Yang is ready for his closeup next month at the first Democratic presidential debate, when he knows most Americans will have one question: “Who is the Asian man standing next to Joe Biden?” ","Democrat Andrew Yang wants to be president - and give you $1,000 a month"
Ginger Gibson,"May 15, 2019 /  10:15 AM / 20 days ago","WASHINGTON (Reuters) - Expanding on her gun control proposals, U.S. Senator Kamala Harris will announce on Wednesday that if elected president she will prohibit imports of some high-powered guns into the United States. ",Senator Harris to promise ban on U.S. imports of some high-powered guns
Nichola Groom,"May 15, 2019 /  7:52 PM / 19 days ago","(Reuters) - U.S. Interior Secretary David Bernhardt told a panel of U.S. lawmakers on Wednesday that he has not lost sleep over record amounts of carbon dioxide recorded in the Earth’s atmosphere, which scientists warn are altering the global climate. ",Trump Interior chief not losing sleep over record CO2 levels
Idrees Ali,"May 11, 2019 /  11:13 AM / 23 days ago","MCALLEN, Texas (Reuters) - Acting U.S. Defense Secretary Patrick Shanahan made his second trip to the U.S.-Mexico border on Saturday as the Pentagon looks to develop a longer-term plan to support President Donald Trump’s immigration policies.  ",Pentagon eyes longer-term support on U.S.-Mexico border
,"May 15, 2019 /  9:20 PM / 19 days ago","WASHINGTON (Reuters) - Senior Democrats and Republicans in the House of Representatives called on Turkey on Wednesday to cancel its planned acquisition of a Russian S-400 missile defense system, the latest effort by U.S. lawmakers to discourage Ankara from pursuing the deal. ",U.S. House members criticize Turkey over Russia ties
,"May 16, 2019 /  5:31 PM / 18 days ago",(Reuters) - Canadian Prime Minister Justin Trudeau on Thursday promised that  efforts to regulate social media in Canada would include “meaningful financial consequences” for online platforms that fail to counter disinformation. ,Canada's Trudeau pledges 'consequences' for disinformation on online platforms
Susan Cornwell,"May 14, 2019 /  12:00 AM / 21 days ago",WASHINGTON (Reuters) - U.S. Democratic leaders on Monday rallied behind a freshman lawmaker on Monday after President Donald Trump and other Republicans attacked her over comments about the Holocaust and Palestinians. ,Democratic leaders back Muslim lawmaker after Holocaust comments
Mark Hosenball,"May 13, 2019 /  7:45 PM / 21 days ago","WASHINGTON (Reuters) - Chelsea Manning, a former U.S. Army intelligence analyst and source for online publisher WikiLeaks, could be jailed again if she refuses to comply with a new grand jury subpoena, said a U.S. law enforcement source, as well as Manning herself. ",WikiLeaks source Manning could be jailed again soon if she disobeys U.S. grand jury
,"May 9, 2019 /  12:26 AM / a month ago","(Reuters) - Denver will become the first city in the United States to decriminalize magic mushrooms, based on final unofficial results on Wednesday of a ballot initiative about the hallucinogenic drug. ",Denver votes to become first U.S. city to decriminalize 'magic mushrooms'
,"May 9, 2019 /  8:36 PM / 25 days ago","WASHINGTON (Reuters) - Patrick Shanahan said on Thursday he was honored by President Donald Trump’s plan to nominate him to be defense secretary, after more than four months performing the job in an acting capacity. ",Shanahan: honored by Trump's nomination to be defense secretary
"Sarah N. Lynch,Andy Sullivan","May 9, 2019 /  2:49 PM / 25 days ago","WASHINGTON (Reuters) - Rod Rosenstein, who oversaw Special Counsel Robert Mueller’s Russia investigation, wrapped up his high-profile tenure at the U.S. Justice Department as his likely replacement moved closer to confirmation in the U.S. Senate on Thursday. ",Deputy Attorney General Rosenstein says farewell; Senate set to confirm his replacement
Daniel Trotta,"May 9, 2019 /  3:55 PM / 25 days ago",(Reuters) - Alabama’s state Senate on Thursday delayed until next week a vote on the strictest abortion bill in the United States after disagreement arose on the Senate floor about whether to allow women impregnated by rape and incest to have a legal abortion. ,Alabama Senate delays vote on strict anti-abortion bill
,"May 15, 2019 /  4:50 AM / 20 days ago","BEIJING (Reuters) - China’s top battery maker, Contemporary Amperex Technology Co Ltd (CATL), said it had signed a multi-billion dollar battery supply deal with Volvo Car Group.  ",China's CATL signs multi-billion-dollar battery supply deal with Volvo
"Patricia Zengerle,Matt Spetalnick","May 2, 2019 /  9:45 PM / a month ago","WASHINGTON (Reuters) - President Donald Trump’s tough approach to Venezuela has won broad support from both Republicans and Democrats in the U.S. Congress, but this rare display of bipartisan consensus is starting to show signs of strain as the crisis in the OPEC nation drags on. ",Cracks appear in U.S. bipartisan unity on Venezuela
Steve Holland,"May 2, 2019 /  10:11 AM / a month ago","WASHINGTON (Reuters) - Joe Biden’s rapid emergence as front-runner in the race for the 2020 Democratic presidential nomination has caught the attention of President Donald Trump and unnerved some of his allies, who believe Biden is a potentially dangerous rival. ","Biden's rise in 2020 race catches Trump's eye, unnerves his allies"
Katie Paul,"May 2, 2019 /  11:05 PM / a month ago",SAN FRANCISCO (Reuters) - Facebook Inc said on Thursday it was banning Alex Jones and other controversial U.S. political personalities for violating the social media company’s policies on “dangerous individuals and organizations.” ,"Facebook bans Alex Jones, other extremist figures"
Akanksha Rana,"May 9, 2019 /  8:12 PM / in 25 days","(Reuters) - GoPro Inc raised its full-year revenue forecast and reported a smaller-than-expected loss on Thursday, boosted by strong demand for its new line of action cameras from its flagship brand HERO, sending its shares up 13 percent. ",GoPro raises revenue forecast on strong demand for new cameras
Stephen Nellis,"May 10, 2019 /  1:39 AM / 25 days ago","(Reuters) - A U.S. startup company is accusing Chinese telecommunications gear provider Huawei of enlisting a Chinese university professor working on a research project to improperly access the startup’s technology, according to court documents filed last week. ",U.S. firm accuses Huawei of enlisting professor to obtain its tech
Arjun Panchadar,"May 9, 2019 /  8:17 PM / 25 days ago","(Reuters) - File sharing and storage company Dropbox Inc raised its full-year revenue forecast and reported better-than-expected quarterly results, as it added more paying subscribers. ",Dropbox raises full-year revenue forecast as paying users rise
"Ann Saphir,Koh Gui Qing","May 2, 2019 /  1:09 PM / a month ago","(Reuters) - Economic commentator Stephen Moore has withdrawn from consideration for a seat on the U.S. Federal Reserve Board after weeks of criticism about his political partisanship, shifting views on interest rate policy, and sexist comments about women.  ","Moore, under fire, withdraws from bid for Fed post"
,"May 9, 2019 /  8:28 PM / 25 days ago","WASHINGTON (Reuters) - A federal grand jury charged a Chinese national in a 2015 hacking campaign that affected large U.S. businesses including insurer Anthem Inc, where the breach affected a computer system containing data on nearly 80 million people, according to an indictment unsealed on Thursday. ","U.S. charges Chinese national in hacks of Anthem, other businesses"
"Kate Holton,Jane Lanhee Lee","May 9, 2019 /  11:15 AM / 25 days ago",LONDON/SAN FRANCISCO (Reuters) - Uber drivers in London and major U.S. cities held a series of strikes on Wednesday to protest the disparity between gig-economy conditions and the sums that investors are likely to make in Friday’s blockbuster stock market debut. ,"Uber drivers go on strike in London and U.S. ahead of IPO, early protests sparse"
"Angela Moon,Vibhuti Sharma","May 9, 2019 /  8:28 PM / 25 days ago","(Reuters) - Symantec Corp’s chief executive officer stepped down unexpectedly on Thursday, the same day the antivirus software maker issued a profit warning, sending the shares plunging in after-hours trading.  ",Symantec CEO to step down in abrupt departure as company warns on profit
Heather Somerville,"May 10, 2019 /  5:08 AM / 25 days ago","SAN FRANCISCO (Reuters) - In 2015, Uber Technologies Inc went on a fundraising spree in China, tapping venture capitalists and state-backed corporations for cash and connections to try and navigate the Chinese regulatory environment. ","Cashing out in Uber's IPO: China, Russia and the Middle East"
Joshua Franklin,"May 9, 2019 /  11:10 AM / 24 days ago","NEW YORK (Reuters) - Uber Technologies Inc priced its initial public offering on Thursday at the low end of its targeted range for a valuation of $82.4 billion, hoping its conservative approach will spare it the trading plunge suffered by rival Lyft Inc. ","Uber valued at $82 billion in IPO as market jitters, Lyft woes weigh"
,"May 10, 2019 /  12:51 PM / 24 days ago","(Reuters) - Chinese e-commerce firm JD.com’s revenues grew at their slowest pace on record in the first quarter as China’s tech giants start to tap out their existing user bases, though its 21% expansion marginally beat analysts’ forecasts.  ",China's JD reports slowest revenue growth on record in first quarter
,"May 6, 2019 /  1:52 PM / a month ago",WASHINGTON (Reuters) - The U.S. House Judiciary Committee on Monday issued a report citing Attorney General William Barr for contempt over a panel subpoena seeking Special Counsel Robert Mueller’s full unredacted report on his Russia investigation. ,House panel issues report citing Barr for contempt
Aditya Kalra,"May 10, 2019 /  11:50 AM / 24 days ago","NEW DELHI (Reuters) - India’s antitrust watchdog has ordered an investigation into Alphabet Inc’s unit Google for allegedly abusing the dominant position of its popular Android mobile operating system to block rivals, two sources aware of the matter told Reuters. ",Exclusive: India orders anti-trust probe of Google for alleged Android abuse - sources
Amanda Becker,"May 6, 2019 /  4:25 PM / a month ago","WASHINGTON (Reuters) - U.S. Senator Cory Booker on Monday released a sweeping plan to curb gun violence by creating a national licensing program and repealing a law that gives gun manufacturers legal immunity, becoming the latest Democrat in the 2020 presidential race to make gun control measures a feature of their campaign. ",Gun control takes center stage in 2020 Democratic presidential race
Brendan Pierson,"May 6, 2019 /  10:04 AM / a month ago","NEW YORK (Reuters) - Michael Cohen, President Donald Trump’s former personal lawyer, took a parting shot at his former boss - denouncing “xenophobia, injustice and lies” - before reporting to a U.S. federal prison on Monday to begin a three-year sentence. ","Ex-lawyer Cohen reports to prison, blasts Trump for 'injustice and lies'"
Karen Freifeld,"May 10, 2019 /  10:01 PM / 24 days ago","(Reuters) - Huawei Technologies Co Ltd lawyer James Cole’s prior work at the U.S. Department of Justice created conflicts of interest that should disqualify him from defending the Chinese company in a case of alleged bank fraud and sanctions violations, U.S. prosecutors said in a filing on Friday.  ",U.S. says Huawei lawyer's prior work at Justice Department poses conflicts
,"May 10, 2019 /  12:15 PM / 22 days ago","CHYNOVSKA JESKYNE, Czech Republic (Reuters) - Czech speleologists have come up with a way to explore flooded cave systems without strapping on scuba gear, wet suits, helmets and water-proof lamps: 3D mapping. ",Now you can explore a cave without actually going into a cave
,"May 13, 2019 /  9:35 AM / 22 days ago","BEIJING (Reuters) - Tencent Holdings Ltd’s alternative to its video game “PlayerUnknown’s Battlegrounds” (PUBG) in China became the world’s top-grossing mobile battle royale title on Apple’s iOS app store in the first 72 hours of its launch, research showed. ",Tencent's PUBG replacement 'Game for Peace' rakes in $14 million in 72 hours
"Paresh Dave,Sheila  Dang","May 13, 2019 /  10:10 AM / 21 days ago","SAN FRANCISCO/NEW YORK (Reuters) - Three years ago, the beginning of the end of the U.S. television business looked certain when one of the largest ad buying agencies vowed to move a big chunk of its purchases to YouTube from TV budgets. ",TV networks emerge as obstacles on YouTube's hunt for ads
Yimou Lee,"May 13, 2019 /  3:34 AM / 21 days ago","TAIPEI (Reuters) - Foxconn is poised to nominate chip unit boss Liu Young to succeed Terry Gou as chairman in a surprise choice by the iPhone assembler, two people with direct knowledge of the matter said. ",Taiwan's Foxconn readies chip boss to succeed Gou as chairman: sources
